{
  "schema": "openphone.island_state.v1",
  "revision": 12,
  "mode": "idle",
  "label": "OpenPhone",
  "title": "Ready",
  "detail": "",
  "visible": true,
  "needs_attention": false,
  "sensitivity": "public",
  "active_task_id": "",
  "pending_confirmation_id": "",
  "live_runs": 0,
  "updated_at": 1784410000000,
  "published_at": 1784410000001,
  "published_elapsed_ms": 22000,
  "source": "assistant"
}
